{
  "registry_id": "gamma-central-registry",
  "version": "1.0.0",
  "timestamp": "2026-05-03T00:00:00Z",
  "maintainer": "HNXJ (H. Nejat)",
  "entries": [
    {
      "entry_id": "harness_beta_audit",
      "type": "harness",
      "harness_id": "beta-audit",
      "name": "BETA Protocol: Read-Only Audit Harness",
      "description": "Grounding harness for read-only audit, risk discovery, and baseline assessment before major operations",
      "registration_date": "2026-01-15T00:00:00Z",
      "status": "active",
      "plane": "Control",
      "protocol": "BETA",
      "location": "hellenic/beta.md",
      "version": "1.0.0",
      "tags": ["audit", "grounding", "preflight", "low-risk"],
      "dependencies": []
    },
    {
      "entry_id": "harness_alpha_planning",
      "type": "harness",
      "harness_id": "alpha-planning",
      "name": "ALPHA Protocol: Planning and Architecture Harness",
      "description": "Planning harness for architecture, task decomposition, and strategy definition",
      "registration_date": "2026-01-15T00:00:00Z",
      "status": "active",
      "plane": "Control",
      "protocol": "ALPHA",
      "location": "hellenic/alpha.md",
      "version": "1.0.0",
      "tags": ["planning", "architecture", "strategy"],
      "dependencies": ["harness_beta_audit"]
    },
    {
      "entry_id": "harness_gamma_execution",
      "type": "harness",
      "harness_id": "gamma-execution",
      "name": "GAMMA Protocol: Exact Execution Harness",
      "description": "Execution harness for precise, manifest-driven task execution with file tracking and command recording",
      "registration_date": "2026-01-15T00:00:00Z",
      "status": "active",
      "plane": "Execution",
      "protocol": "GAMMA",
      "location": "hellenic/gamma.md",
      "version": "1.0.0",
      "tags": ["execution", "manifest", "precise", "critical"],
      "dependencies": ["harness_alpha_planning"]
    },
    {
      "entry_id": "harness_delta_resolution",
      "type": "harness",
      "harness_id": "delta-resolution",
      "name": "DELTA Protocol: Conflict Resolution Harness",
      "description": "Resolution harness for factual drift reconciliation and claim conflict resolution",
      "registration_date": "2026-01-15T00:00:00Z",
      "status": "active",
      "plane": "Truth",
      "protocol": "DELTA",
      "location": "hellenic/delta.md",
      "version": "1.0.0",
      "tags": ["conflict", "resolution", "drift", "reconciliation"],
      "dependencies": ["harness_gamma_execution"]
    },
    {
      "entry_id": "harness_theta_validation",
      "type": "harness",
      "harness_id": "theta-validation",
      "name": "THETA Protocol: Post-Execution Validation Harness",
      "description": "Validation harness for post-execution QA, evidence collection, and artifact verification",
      "registration_date": "2026-01-15T00:00:00Z",
      "status": "active",
      "plane": "Observation",
      "protocol": "THETA",
      "location": "hellenic/theta.md",
      "version": "1.0.0",
      "tags": ["validation", "qa", "evidence", "verification"],
      "dependencies": ["harness_gamma_execution", "harness_delta_resolution"]
    },
    {
      "entry_id": "harness_gamma_burst_reconstruction",
      "type": "harness",
      "harness_id": "gamma-burst-reconstruction",
      "name": "GAMMA-BURST Protocol: Major Reconstruction Harness",
      "description": "Specialized harness for one-time major refactor or reconstruction with mandatory preflight BETA, rollback points, manifest, and post-execution THETA",
      "registration_date": "2026-01-15T00:00:00Z",
      "status": "active",
      "plane": "Execution",
      "protocol": "GAMMA-BURST",
      "location": "hellenic/gamma_burst.md",
      "version": "1.0.0",
      "tags": ["reconstruction", "refactor", "major", "critical", "high-risk"],
      "dependencies": ["harness_beta_audit", "harness_alpha_planning", "harness_gamma_execution", "harness_theta_validation"]
    },
    {
      "entry_id": "skill_mllm_speed_estimator",
      "type": "skill",
      "harness_id": "mllm-speed-estimator",
      "name": "MLLM Speed Estimator (TPS)",
      "description": "Standardized TPS (Tokens Per Second) calculation and performance logging for MLLM outputs",
      "registration_date": "2026-02-01T00:00:00Z",
      "status": "active",
      "plane": "Execution",
      "protocol": "GAMMA",
      "location": "examples/skills/mllm_speed_estimator.example.md",
      "version": "1.0.0",
      "tags": ["performance", "mllm", "optimization", "telemetry"],
      "dependencies": []
    },
    {
      "entry_id": "mission_continuous_growth",
      "type": "harness",
      "harness_id": "continuous-growth",
      "name": "Mission: Continuous Growth (N → N+1)",
      "description": "Prime mission of the neural expansion arcade. Increase substrate knowledge base from N to N+1 with receipt-backed validation.",
      "registration_date": "2026-02-15T00:00:00Z",
      "status": "active",
      "plane": "Truth",
      "protocol": "GAMMA",
      "location": "gameplay/missions/continuous_growth.md",
      "version": "1.0.0",
      "tags": ["mission", "neural-expansion", "growth", "truth-mutation"],
      "dependencies": []
    }
  ],
  "statistics": {
    "total_entries": 8,
    "active_entries": 8,
    "by_type": {
      "harness": 6,
      "skill": 1,
      "tool": 0,
      "adapter": 0
    },
    "by_plane": {
      "Control": 2,
      "Execution": 3,
      "Truth": 2,
      "Observation": 1
    }
  }
}
